{
  "employeeId": "INT001",
  "employeeName": "Sara Khan",
  "designation": "Software Engineering Intern",
  "startDate": "2026-05-01",
  "endDate": "2026-07-15",
  "conductRemark": "consistently high quality and delivered ahead of schedule",
  "letterDate": "2026-07-16",
  "certificateId": "F2T-INT-2026-0017"
}
